[
  {
    "id": "unit_m5_test_ally_poison",
    "name": "M5 Ally Poison",
    "faction": "tangmen",
    "quality": "orange",
    "cost": 5,
    "role": "caster",
    "base_star": 1,
    "max_star": 3,
    "base_stats": {
      "hp": 2200,
      "mp": 220,
      "atk": 185,
      "iat": 210,
      "def": 95,
      "idr": 108,
      "spd": 108,
      "rng": 3,
      "mov": 82,
      "wis": 86
    },
    "initial_gongfa": ["gongfa_wudu_shou", "eq_duchangjian", "eq_xixue_jie"],
    "sprite_path": "assets/sprites/units/unit_m5_test_ally_poison.png",
    "portrait_path": "assets/sprites/portraits/unit_m5_test_ally_poison.png",
    "tags": ["m5_test", "ally", "poison"]
  },
  {
    "id": "unit_m5_test_ally_fire",
    "name": "M5 Ally Fire",
    "faction": "mingjiao",
    "quality": "orange",
    "cost": 5,
    "role": "vanguard",
    "base_star": 1,
    "max_star": 3,
    "base_stats": {
      "hp": 2600,
      "mp": 210,
      "atk": 210,
      "iat": 165,
      "def": 112,
      "idr": 90,
      "spd": 102,
      "rng": 2,
      "mov": 80,
      "wis": 72
    },
    "initial_gongfa": ["gongfa_lie_yan_zhang", "eq_liuhuoyi", "eq_dihuo_jia"],
    "sprite_path": "assets/sprites/units/unit_m5_test_ally_fire.png",
    "portrait_path": "assets/sprites/portraits/unit_m5_test_ally_fire.png",
    "tags": ["m5_test", "ally", "fire"]
  },
  {
    "id": "unit_m5_test_ally_ice",
    "name": "M5 Ally Ice",
    "faction": "xiaoyao",
    "quality": "orange",
    "cost": 5,
    "role": "caster",
    "base_star": 1,
    "max_star": 3,
    "base_stats": {
      "hp": 2350,
      "mp": 240,
      "atk": 160,
      "iat": 230,
      "def": 96,
      "idr": 116,
      "spd": 106,
      "rng": 3,
      "mov": 78,
      "wis": 90
    },
    "initial_gongfa": ["gongfa_han_bing_jue", "eq_hanbingmian", "eq_guiyuan_zhen"],
    "sprite_path": "assets/sprites/units/unit_m5_test_ally_ice.png",
    "portrait_path": "assets/sprites/portraits/unit_m5_test_ally_ice.png",
    "tags": ["m5_test", "ally", "ice"]
  },
  {
    "id": "unit_m5_test_ally_heal",
    "name": "M5 Ally Heal",
    "faction": "emei",
    "quality": "orange",
    "cost": 5,
    "role": "healer",
    "base_star": 1,
    "max_star": 3,
    "base_stats": {
      "hp": 2450,
      "mp": 240,
      "atk": 155,
      "iat": 205,
      "def": 105,
      "idr": 126,
      "spd": 103,
      "rng": 3,
      "mov": 76,
      "wis": 92
    },
    "initial_gongfa": ["gongfa_cihang_jian", "eq_huiqi_zhu", "eq_zhanshen_kai"],
    "sprite_path": "assets/sprites/units/unit_m5_test_ally_heal.png",
    "portrait_path": "assets/sprites/portraits/unit_m5_test_ally_heal.png",
    "tags": ["m5_test", "ally", "heal"]
  },
  {
    "id": "unit_m5_test_ally_mark",
    "name": "M5 Ally Mark",
    "faction": "huashan",
    "quality": "orange",
    "cost": 5,
    "role": "assassin",
    "base_star": 1,
    "max_star": 3,
    "base_stats": {
      "hp": 2280,
      "mp": 210,
      "atk": 235,
      "iat": 158,
      "def": 88,
      "idr": 90,
      "spd": 122,
      "rng": 1,
      "mov": 88,
      "wis": 95
    },
    "initial_gongfa": ["gongfa_poying_jian", "eq_zhanshazhui", "eq_bixie_sword"],
    "sprite_path": "assets/sprites/units/unit_m5_test_ally_mark.png",
    "portrait_path": "assets/sprites/portraits/unit_m5_test_ally_mark.png",
    "tags": ["m5_test", "ally", "mark"]
  },
  {
    "id": "unit_m5_test_enemy_poison",
    "name": "M5 Enemy Poison",
    "faction": "xingxiu",
    "quality": "orange",
    "cost": 5,
    "role": "caster",
    "base_star": 1,
    "max_star": 3,
    "base_stats": {
      "hp": 2500,
      "mp": 220,
      "atk": 178,
      "iat": 220,
      "def": 98,
      "idr": 108,
      "spd": 102,
      "rng": 3,
      "mov": 80,
      "wis": 84
    },
    "initial_gongfa": ["gongfa_shixiang_ban", "eq_duchangjian", "eq_dihuo_jia"],
    "sprite_path": "assets/sprites/units/unit_m5_test_enemy_poison.png",
    "portrait_path": "assets/sprites/portraits/unit_m5_test_enemy_poison.png",
    "tags": ["m5_test", "enemy", "poison"]
  },
  {
    "id": "unit_m5_test_enemy_thunder",
    "name": "M5 Enemy Thunder",
    "faction": "gaibang",
    "quality": "orange",
    "cost": 5,
    "role": "vanguard",
    "base_star": 1,
    "max_star": 3,
    "base_stats": {
      "hp": 2700,
      "mp": 205,
      "atk": 228,
      "iat": 150,
      "def": 118,
      "idr": 88,
      "spd": 104,
      "rng": 1,
      "mov": 84,
      "wis": 78
    },
    "initial_gongfa": ["gongfa_kuanglei_zhang", "eq_fenglei_huan", "eq_pojia_chuizi"],
    "sprite_path": "assets/sprites/units/unit_m5_test_enemy_thunder.png",
    "portrait_path": "assets/sprites/portraits/unit_m5_test_enemy_thunder.png",
    "tags": ["m5_test", "enemy", "knockback"]
  },
  {
    "id": "unit_m5_test_enemy_ice",
    "name": "M5 Enemy Ice",
    "faction": "mingjiao",
    "quality": "orange",
    "cost": 5,
    "role": "caster",
    "base_star": 1,
    "max_star": 3,
    "base_stats": {
      "hp": 2450,
      "mp": 235,
      "atk": 165,
      "iat": 226,
      "def": 98,
      "idr": 114,
      "spd": 101,
      "rng": 3,
      "mov": 78,
      "wis": 90
    },
    "initial_gongfa": ["gongfa_xuanming_shen", "eq_hanbingmian", "eq_guiyuan_zhen"],
    "sprite_path": "assets/sprites/units/unit_m5_test_enemy_ice.png",
    "portrait_path": "assets/sprites/portraits/unit_m5_test_enemy_ice.png",
    "tags": ["m5_test", "enemy", "ice"]
  },
  {
    "id": "unit_m5_test_enemy_tank",
    "name": "M5 Enemy Tank",
    "faction": "wudang",
    "quality": "orange",
    "cost": 5,
    "role": "leader",
    "base_star": 1,
    "max_star": 3,
    "base_stats": {
      "hp": 2950,
      "mp": 220,
      "atk": 198,
      "iat": 142,
      "def": 132,
      "idr": 112,
      "spd": 96,
      "rng": 2,
      "mov": 76,
      "wis": 84
    },
    "initial_gongfa": ["gongfa_gui_xi_gong", "eq_zhanshen_kai", "eq_fenix_yu"],
    "sprite_path": "assets/sprites/units/unit_m5_test_enemy_tank.png",
    "portrait_path": "assets/sprites/portraits/unit_m5_test_enemy_tank.png",
    "tags": ["m5_test", "enemy", "tank"]
  },
  {
    "id": "unit_m5_test_enemy_mark",
    "name": "M5 Enemy Mark",
    "faction": "huashan",
    "quality": "orange",
    "cost": 5,
    "role": "assassin",
    "base_star": 1,
    "max_star": 3,
    "base_stats": {
      "hp": 2350,
      "mp": 215,
      "atk": 238,
      "iat": 152,
      "def": 92,
      "idr": 88,
      "spd": 124,
      "rng": 1,
      "mov": 90,
      "wis": 98
    },
    "initial_gongfa": ["gongfa_poying_jian", "eq_zhanshazhui", "eq_bixie_sword"],
    "sprite_path": "assets/sprites/units/unit_m5_test_enemy_mark.png",
    "portrait_path": "assets/sprites/portraits/unit_m5_test_enemy_mark.png",
    "tags": ["m5_test", "enemy", "mark"]
  }
]
